{
  "schemaVersion": "ofarm.materializationsnapshot.v0.1",
  "snapshotId": "snapshot:field-17:dossier-basis:2026-04-10T10:00:00Z",
  "generatedAt": "2026-04-10T10:00:00Z",
  "twin": "COMPLIANCE",
  "anchorScopes": [
    {
      "scopeType": "FIELD",
      "scopeRef": "field:17"
    }
  ],
  "materializationBasisRef": "basis:field-17:compliance:2026-04-10T09:35:00Z",
  "freshnessState": "FRESH",
  "declaredUseClass": "ATTESTED_OUTPUT",
  "retentionReason": "Inspection DossierAssembly relied on this exact current-state answer during attestation preparation.",
  "materializedStateRef": "current-state:field-17:compliance:2026-04-10T10:00:00Z"
}
